tmdb_id,budget,genres,homepage,id,keywords,original_language,original_title,overview,popularity,production_companies,production_countries,release_date,revenue,runtime,spoken_languages,status,tagline,title,vote_average,vote_count
185008,7700000,"Liebesfilm, Komödie",,185008,,hi,ये जवानी है दीवानी,"Naina ist ihr Streber-Dasein leid: Hals über Kopf schmeißt sie die Unibücher hin und folgt ihrer alten Schulfreundin Aditi auf eine Trekkingtour. In den Bergen des Himalayas blüht sie nicht nur auf, sondern kommt auch dem abenteuerlustigen ""Bunny"" näher. Ihre Liebe wagt sie dem charmanten Frauenheld nicht zu gestehen, denn an festen Bindungen ist er nicht interessiert. Bunny hat nur die große, weite Welt im Kopf. Erst acht Jahre später treffen sie sich auf Aditis Hochzeit wieder. Bunny scheint noch immer derselbe. Und doch: Zwischen dem weltreisenden Journalisten und der Ärztin aus Mumbai knistert es noch immer gewaltig. Doch wie soll man zwei so unterschiedliche Lebensentwürfe vereinen? Indem man einfach seinem Herzen folgt.",10.428,"Dharma Productions, UTV Motion Pictures, Eros International",India,2013-05-31,46000000,160.0,हिन्दी,Released,"Bollywood, Lovestory",Yeh Jawaani Hai Deewani - Lass dein Glück nicht ziehen,7.245,265
14353,8500000,"Horror, Science Fiction, Musik",,14353,,en,Repo! The Genetic Opera,"In einer nicht weit entfernten Zukunft wird die Menschheit von einem übergreifenden Organversagen heimgesucht. Ein Multi Milliarden Konzern übernimmt das Monopol auf die Organversorgung und fordert bei Nichteinhaltung der Zahlung die Ware gnadenlos zurück, indem sie die Repo Men für die Wiederbeschaffung beauftragt.",9.715,"Twisted Pictures, Lionsgate, Mandate Pictures",United States of America,2008-11-07,188126,94.0,English,Released,,Repo! The Genetic Opera,6.253,340
11818,10000000,"Action, Kriegsfilm, Drama",,11818,,tr,Kurtlar Vadisi: Irak,"Türkischer Actionfilm aus dem Jahr 2006, der auf einer erfolgreichen türkischen TV-Serie basiert und dem Helden der Serie, Polat Alemdar, in den Irak folgt, wo er als Agent eines türkischen Geheimdienstes gegen die Mafia kämpft. Teuerste türkische Produktion aller Zeiten.",8.687,Pana Film,Turkey,2006-01-31,0,122.0,"العربية, English, , Türkçe",Released,,Tal der Wölfe - Irak,5.2,80
10885,0,"Horror, Mystery, Thriller",,10885,,en,Shutter,"Eine finanziell aussichtsreiche Anstellung lockt den Modefotografen Benjamin Shaw (Joshua Jackson) und seine Frau Jane (Rachael Taylor) in die japanische Hauptstadt. Dort freut sich das Paar über den Geldsegen, hat ein schickes Apartment und genießt das Leben in der Metropole. Doch dann passiert ein mysteriöser Autounfall. Hier wird zwar niemand ernsthaft verletzt, doch Jane hat eine beunruhigende Entdeckung gemacht, auf der sie beharrt: Sie sagt, kurz vor dem Zusammenprall eine geheimnisvolle junge Frau auf der Straße gesehen zu haben. Gerade wurde der Vorfall abgehakt, da sind auf Benjamins Fotos plötzlich unheimliche milchige Fratzen zu sehen. Er behauptet, die geisterhaften Erscheinungen seien unbedeutende Entwicklungsfehler, aber Jane lässt sich davon nicht beruhigen und beginnt eine Recherche. Dabei entdeckt sie dunkle Seiten an ihrem Ehemann, die ihr bisher verborgen waren...",16.096,"Regency Enterprises, New Regency Pictures, Vertigo Entertainment, Ozla Pictures",United States of America,2008-03-21,0,85.0,"English, 日本語",Released,"Die unheimlichsten Fotos sind jene, die echt sind.",Shutter - Sie sehen dich,5.5,738
385736,0,"Drama, Krimi, Action",,385736,,en,Kicks,"Nichts ist so wie es scheint. Der 15-jährige Brandon sehnt sich nach dem neuesten Paar Sneaker, das man sich für Geld kaufen kann, in der Annahme, diese würden ihn durch die traurige Realität der Armut helfen. Außerdem wird er von den Mädchen missachtet und jeder hackt auf ihm herum. Er arbeitet hart dafür, sich die Schuhe leisten zu können, doch kaum hat er sie endlich gekauft, wird er erneut zum Opfer und seine geliebten Sneaker werden ihm gestohlen. Doch dieses Mal kommt ihm der Dieb Flaco nicht so leicht davon und Brian begibt sich gemeinsam mit zwei Freunden auf die gefährliche Mission, sich die Schuhe zurück zu holen. Dabei stellt sich heraus, dass Flacos bedrohliche Erscheinung nur aufgesetzt ist und er mit ganz eigenen Problemen zu kämpfen hat.",8.941,"Bystorm Films, Animal Kingdom, Bow + Arrow Entertainment, Northern Lights Films, Focus Features, LookFilm","Russia, United States of America",2016-09-09,0,87.0,English,Released,,Kicks,6.8,143
14536,8000000,"Komödie, Liebesfilm",,14536,,en,New in Town,"Lucy Hill hat es geschafft: Als erfolgreiche Karrierefrau in Miami kann sie in allen Zügen einen gehobenen Lebensstil genießen, ein teures Auto fahren und stets die Top-Designer-Klamotten kaufen. Eines Tages verschlägt es sie beruflich für einen zeitlich begrenzten Auftrag mitten ins Nirgendwo, in ein Dorf, dessen Namen sie vorher noch nie gehört hat. Anfänglich versucht sie progressiv, ihr Projekt straff durchzuziehen - nicht ohne den örtlichen Mitarbeitern der Firma zu schaden. Bis sie allmählich beginnt, ihr Tun zu hinterfragen und ganz nebenbei auch ihrem Traummann begegnet.",11.115,"The Safran Company, Gold Circle Films, Epidemic Pictures, Edmonds Entertainment Group, Lionsgate, Mandate International",United States of America,2009-01-30,29010817,97.0,"English, Español",Released,,New in Town,5.829,490
15049,8000000,"Action, Komödie, Krimi",,15049,,fr,Bon Cop Bad Cop,"Eine Toter wird an der Grenze zwischen Ontario und Quebec gefunden – Beine in Ontario, Oberkörper in Quebec. Dieser mysteriöse Leichenfund zwingt die Kommissare der jeweiligen kanadischen Provinz zusammenzuarbeiten. Doch die beiden Cops könnten unterschiedlicher nicht sein: Der eine befolgt die Regeln, der andere macht sich seine eigenen. Nachdem weitere Leichen auftauchen, die auf die gleiche Weise ermordet wurden, erhärtet sich der Verdacht, dass die beiden einen Serienmörder finden müssen, der mit äußerster Präzision und Brutalität vorgeht. Dumm nur, dass sich die zwei Cops dabei immer wieder selbst ein Bein stellen und auch mal einen Verdächtigen im Kofferraum vergessen.",8.069,"Park Ex Pictures, Sortie 22",Canada,2006-07-06,12671300,116.0,"English, Français",Released,"Erst schießen, dann fragen",Good Cop Bad Cop,6.4,207
42819,0,Drama,,42819,,en,The City of Your Final Destination,"Der Film handelt von einem iranischen Studenten, der nach seinem Abschluß in Kansas nach Argentinien reist, wo er von der Familie eines verstorbenen Autors die Erlaubnis dafür bekommen will, dessen Biographie zu schreiben.",14.15,"Hyde Park Entertainment, Merchant Ivory Productions",United States of America,2009-03-21,0,114.0,"English, Español",Released,,The City of Your Final Destination,5.7,51
51588,8000000,"Komödie, Liebesfilm",,51588,,en,Prom,"Es gibt viele Nächte während eines High-School-Jahres, aber nur die eine magische Nacht des Abschlussballs. Nova Prescott möchte den perfekten Ball auf die Beine stellen, aber sie ist gezwungen, dabei mit dem unmöglichen Jess zusammenzuarbeiten, den sie absolut nicht leiden kann - anfangs jedenfalls. Doch Jess hält einiges an Überraschungen bereit. Mei und Justin sind schon länger wahnsinnig verliebt, doch da gibt es etwas, was Mei ihrem Liebsten verschweigt. Und obwohl er und Jordan bereits ewig zusammen sind, hat auch Tyler ein dunkles Geheimnis - sind sie doch nicht das perfekte Paar, für das sie alle halten? Die hübsche Simone hat gleich mehrere Verehrer. Lucas schwärmt ganz besonders für sie, doch scheint sie für ihn unerreichbar. Lloyd sucht dagegen eher wahllos nach einem Date für die Nacht der Nächte und Rolo muss beweisen, dass seine Partnerin nicht nur in seiner Phantasie existiert. Jedes Pärchen hat seine ganz eigene Geschichte zu erzählen.",8.527,"Walt Disney Pictures, Rickshaw Productions",United States of America,2011-04-29,10130000,104.0,English,Released,Mit wem gehst du?,Prom - Die Nacht deines Lebens,6.1,453
19489,0,Komödie,,19489,,en,Held Up,"Mit einer Geiselnahme in einer im Niemandsland gelegenen Tankstelle hätte Michael  nun nicht noch gerechnet, als ihm zuerst die Frau weglaufen ist und dann auch noch das Auto geklaut wurde. Die Geiselnehmer gehen bei ihrem Unterfangen jedoch nicht gerade professionell zu Werke. Und als dann auch noch die halbe Kavallerie anrückt, wird die Situation letztendlich immer chaotischer...",5.841,,United States of America,1999-10-08,0,85.0,"Português, Español, Italiano, English",Released,,Held Up - Achtung Geiselnahme!,5.5,53
44009,8000000,"Drama, Komödie",,44009,,en,Another Year,"Um die Liebeswirren des Zweiten Frühlings geht es in Another Year von Mike Leigh. Mary ist eine Frau in den Vierzigern, die nach einer verkorksten ersten Ehe endlich den Mann fürs Leben sucht. In der Zwischenzeit ist sie ständig zu Besuch bei Gerri und Tom die seit Jahrzehnten glücklich miteinander verheiratet sind. Tom versucht Mary mit seinem alten Jugendfreund Ken zu verkuppeln, aber Mary hat fatalerweise ein Auge auf Gerris und Toms Sohn Joe geworfen. Als dieser eines Tages mit einer Freundin auftaucht, reagiert Mary sehr ungehalten, was die Freundschaft zu Gerri und Tom stark strapaziert.",8.454,"Focus Features International, UK Film Council, Film4 Productions, Thin Man Films","United Kingdom, United States of America",2010-11-05,18124262,129.0,English,Released,,Another Year,6.999,394
13154,8000000,"Action, Komödie, Krimi",,13154,,en,Showdown in Little Tokyo,"Im Stadtteil „Little Tokyo“ von Los Angeles treibt eine Yakuza-Organisation ihr Unwesen. Ihre zunehmende Macht im internationalen Drogengeschäft ist ebenso beängstigend wie ihre grausamen Rituale, die auf eine mittelalterliche Kriegerkaste zurückgehen. Sergeant Kenner, der die Bande zur Strecke bringen soll, erhält für diesen Auftrag schlagkräftige Unterstützung von Detective Murata . Als Clubsängerin Minako dann auch noch in das Abenteuer verwickelt wird und Kenner obendrein erfährt, dass es sich bei dem Anführer der Yakuza um den Mörder seiner Eltern handelt, spitzt sich die Lage immer weiter zu.",15.129,"Original Pictures, Little Tokyo Productions",United States of America,1991-08-23,2275557,78.0,"日本語, English",Released,,Showdown in Little Tokyo,6.4,479
45791,0,Drama,,45791,,en,And When Did You Last See Your Father?,"Als Blake Morrison von der unheilbaren Krebserkrankung seines Vater Arthur erfährt, reist er umgehend in seine Heimatstadt Yorkshire, um seine Mutter Kim und seine jüngere Schwester Gillian zu unterstützen. Währenddessen resümiert er Momente aus seinem Leben mit seinem Vater und sein angespanntes Verhältnis diesem gegenüber. Zeitlebens hatte Blake mit seinem Vater zu kämpfen, wenn dieser schamlos mit anderen Frauen flirtete und seine Ehefrau betrog oder er die Laufbahn seines Sohnes als sogar erfolgreicher Schriftsteller nie recht akzeptierte. Dennoch hatten die beiden auch schöne Momente zusammen, wie das gemeinsame Campen oder das Autofahren am menschenleeren Strand. Daher liegt Blake viel daran, die Dinge mit seinem Vater zu klären, um nicht für immer mit gemischten Gefühlen an den Vater zurückdenken zu müssen.",10.568,"Intandem Films, Father Features, Audley Films, Comptom Investments, Film4 Productions, Number 9 Films, Tiger Aspect","Ireland, United Kingdom",2007-10-05,92,92.0,English,Released,,"Die Zeit, die uns noch bleibt",6.602,64
110683,15000000,"Drama, Abenteuer",,110683,,en,The Wicked Lady,"Caroline soll Sir Ralph heiraten und lädt ihre Schwester Barbara ein, ihre Brautjungfer zu sein. Barbara aber verführt Ralph und wird seine neue Lady. Trotz ihres neu gefundenen Wohlstands droht bald Langeweile, der sie mit Straßenraub entgegenwirkt. Auf ihren Raubzügen trifft sie einen berühmten Straßenräuber, und die beiden machen gemeinsame Sache. Doch langsam kommen ihr die Leute auf die Schliche, und wenn sie ihr schändliches Treiben nicht sein lässt, droht ihr der Tod.",4.663,"London-Cannon Films, Dawn Property Company, The Cannon Group, Golan-Globus Productions",United Kingdom,1983-04-21,724912,98.0,English,Released,"Am Tage führte sie ein durchaus anständiges Leben … nachts jedoch regierte sie mit Verführung, Mord und Raub.",Die verruchte Lady,4.9,18
13072,8000000,"Drama, Action, Thriller",,13072,,en,Brooklyn Rules,"Im Brooklyn der 80er herrscht das Gesetz der Straße – und die Mafia. Drei Freunde, die sich kennen, solange sie denken können, lassen sich in diesem Drama von Fragen um Liebe, Verlust und Treue umtreiben. Michael ist ein charmanter Betrüger. Er schreibt sich an der Uni ein und gewinnt das Herz von Ellen, die faszinieren kann. Bobby ist bodenständiger, er plant eine gemeinsame Zukunft mit seiner Freundin. Carmine sucht Wege in die Mafia und fühlt sich besonders von der Gestalt des Caesar angezogen. Der Freund auf Abwegen stellt Michael und Bobby vor die Frage, ob sie es riskieren sollen, sich gegen die Mafia zu stellen oder lieber die langjährige Freundschaft aufs Spiel setzen wollen.",6.346,,United States of America,2007-04-30,458232,99.0,English,Released,Das Gesetz der Straße,Brooklyn Rules,5.783,69
153397,0,,,,,,,Keine Beschreibung verfügbar,0.0,,,,0,0.0,,,,,0.0,0
30141,8000000,"Komödie, Musik, Mystery, Krimi",,30141,,en,The Singing Detective,"Der Autor Dan Dark liegt mit einer extrem schlimmen Hautkrankheit im Krankenhaus und ist bis zu den Haarspitzen vollgepumpt mit Medikamenten. Er beginnt zu halluzinieren und träumt die Inhalte seines ersten Buches noch einmal, in dem er als Detektiv aus den 50ern einen Prostituiertenmord aufzuklären versucht. Zwischen diversen Musicalnummern, erotisierenden Krankenschwestern und sinistren Typen, die ihn verfolgen, strebt er der Aufklärung entgegen...",8.287,"Icon Productions, Haft Entertainment",United States of America,2003-10-24,337174,109.0,English,Released,,The Singing Detective,5.1,127
17044,0,"Drama, Liebesfilm, Kriegsfilm",,17044,,en,The Land Girls,"England im Jahr 1941: Während die Soldaten auf den Schlachtfeldern des Zweiten Weltkrieges melden sich drei junge Frauen freiwillig zur ""Women Lands Army"", soll heißen: Zum Ernteeinsatz an der Heimatfront. So treffen Stella, die Akademikerin Ag und die Friseuse Prudence auf einem abgelegenen Bauernhof der Familie Lawrence in der südenglischen Grafschaft Dorset ein. Während der harten Landarbeit freunden sich die drei unterschiedlichen Frauen an. Joe, der Sohn der Lawrences, schäkert mit ihnen unverhohlen und verliebt sich in Stella, die ihrerseits allerdings mit dem schneidigen Marineoffizier Philip verlobt ist. Die Nachricht von dessen Verletzung im Gefecht holt sie in die Kriegswirklichkeit zurück...",4.019,"Intermedia, Greenpoint Films, Caméra One, West Eleven Films, Arena Films, Canal+, Sofineurope, Channel Four Films","France, United Kingdom",1998-06-12,0,111.0,English,Released,,Brombeerzeit,6.2,23
12183,0,"Komödie, Drama, Liebesfilm",,12183,,en,The Wendell Baker Story,,5.798,"Franchise Pictures, MHF Zweite Academy Film","Germany, United States of America",2005-08-03,0,99.0,English,Released,,The Wendell Baker Story,5.1,69
44147,8000000,"Action, Komödie",http://www.wildtargetmovie.com/,44147,,en,Wild Target,"Der äußerlich unauffällige, stets gepflegte und konzentrierte Junggeselle Victor Maynard gilt als unerreichter Meister in der Zunft der Auftragsmörder. Nun jedoch könnte er zum ersten Mal in seiner langen Karriere versagen, bringt er es doch nicht übers Herz, eine zur Vernichtung erkorene junge Kunstfälscherin um die Ecke zu bringen. Ja, anstatt sie zu töten, gewährt er ihr sogar Asyl und beschützt sie vor den zweitbesten Killern, die ihnen sein erboster Auftraggeber hinterher hetzt. Wie gut, dass ihn wenigstens ein frisch zugelaufener jugendlicher Lehrling unterstützt.",11.815,"Regent Capital, Magic Light Pictures, CinemaNX, Isle of Man Film, Entertainment Film Distributors, Matador Pictures, Cinema Four, Honest Engine Films","France, United Kingdom",2010-06-17,3453043,98.0,English,Released,Sein schärfstes Ziel,Wild Target,6.4,715
36597,0,,,,,,,Keine Beschreibung verfügbar,0.0,,,,0,0.0,,,,,0.0,0
251321,8000000,Drama,,251321,,en,Aloft,,10.169,"Buffalo Gal Pictures, Wanda Visión, Arcadia Motion Pictures","Canada, France, Spain",2014-02-12,53086,112.0,"Français, English",Released,,Aloft,5.5,125
10425,22000000,"Drama, Action, Thriller, Krimi",,10425,,en,The Death and Life of Bobby Z,"Der im Gefängnis einsitzende Ex-Marine Tim Kearney lässt sich auf das verlockende Angebot des DEA-Agenten Tad Grusza ein: Er soll den verschollenen, sagenumwobenen Drogenbaron Bobby Z spielen und sich gegen Grusza’s Partner, der von der mexikanischen Drogenmafia festgehalten wird, austauschen lassen. Danach wäre er frei. Doch die Übergabe geht unter dem Kugelhagel der beiden Parteien schief. Von allen gehetzt, ohne zu wissen, was wirklich gespielt wird, und auf der Jagd nach Bobby Zs sagenhaftem Vermögen flieht T. Kearney mit dem Sohn des echten Bobby Z im Schlepptau.",22.289,"Eclectic pictures, Millennium Media","Germany, United States of America",2007-07-23,413454,97.0,English,Released,,Kill Bobby Z - Ein Deal um Leben und Tod,6.125,371
49081,8000000,Drama,,49081,,fr,Maurice Richard,,3.025,"Cinémaginaire, Alliance Films",Canada,2005-10-25,2019009,124.0,"English, Français",Released,,Maurice Richard,6.7,44
220488,0,"Komödie, Liebesfilm",,220488,,zh,非常幸运,,3.086,Bona International Film Group,China,2013-09-17,0,114.0,普通话,Released,,非常幸运,4.8,14
374461,8000000,Drama,,374461,,en,Mr. Church,"Die 10-jährige Charlie wacht eines Morgens auf, nur um festzustellen, dass in der Küche des Hauses, in dem sie mit ihrer Mutter Marie lebt, ein Fremder steht und ihr Frühstück zubereitet. Henry Joseph Church wurde von Maries ehemaligem Liebhaber angeheuert, solange für Mutter und Tochter zu sorgen, bis Marie stirbt. Da Charlie nichts von der Krankheit ihrer Mutter weiß, begegnet sie dem Koch anfangs mit einigem Misstrauen. Doch Marie lebt viel länger, als ihre Ärzte gedacht hatten, und so entwickelt sich über die Jahre langsam eine freundschaftliche Beziehung zwischen Charlie und Mr. Church, gleichwohl der sonst so freundliche Ersatzvater über sein Privatleben absolutes Stillschweigen hält. Als Marie schlussendlich doch noch ihrer Krankheit erliegt und die mittlerweile am College studierende Charlie nach einem One-Night-Stand schwanger wird, nimmt Mr. Church sie bei sich auf …",12.475,"Shenghua Entertainment, Cinelou Films, Envision Media Arts",United States of America,2016-09-16,0,105.0,English,Released,Es gibt immer einen Weg nach Hause.,Mr. Church,7.385,469
182873,0,"Action, Drama",,182873,,en,Green Street Hooligans: Underground,"Vor Jahren hat Danny sein Viertel und die Kumpel von der Westham Firm verlassen, um Kampfsport-Profi zu werden. Seine Karriere beweist, dass er das Richtige getan hat. Zweifel kommen ihm erst, als sein Bruder erschlagen wird. Eigentlich wollte er immer für Joey da sein, doch jetzt ist er tot. Danny kehrt nach Hause zurück und nimmt Kontakt zur alten Gang auf. Viel hat sich verändert in der Szene. Statt wilder Straßenschlägereien finden durchorganisierte Kämpfe statt. So etwas wie eine Liga ist entstanden und um die Platzierungen herum floriert das Wettgeschäft. Kämpfer auf Profi-Niveau dominieren, die altgedienten Hooligans können da nicht mithalten. Joey war hier sehr aktiv und irgendwo sind auch die Männer, die ihn getötet haben …",11.368,Tea Shop & Film Company,United Kingdom,2013-10-21,0,94.0,English,Released,,Hooligans 3 - Never Back Down,5.367,147
389425,8000000,"Action, Krimi, Thriller",,389425,,en,Code of Honor,"Colonel Robert Sikes ein Elitesoldat, kehrt aus dem Einsatz im Mittleren Osten zurück. Während er im Krieg war, wurden zu Hause seine Frau und sein Sohn erschossen – zufällige Opfer einer Auseinandersetzung zweier Gangs. Er ist verzweifelt und hat nur noch ein Ziel: seine Stadt vom Abschaum zu befreien. Als Ein-Mann-Einheit operiert er im Untergrund, heimlich, verborgen vor den Augen der Polizei und erst Recht vor den Verbrechern. Er will die Stadt von korrupten Politikern und Polizisten, Kriminellen und den allgegenwärtigen Gangs befreien. Doch seine Art der Selbstjustiz ist ebenso kriminell wie die Leute, die er jagt. Sein ehemaliger Schützling William Porter dem er auch das Töten beigebracht hat, tut sich mit der Polizei zusammen, um Sikes zu stoppen und ihn vor sich selbst zu schützen. Doch einer spielt ein falsches Spiel...",14.694,"Premiere Entertainment Group, Steamroller Productions",United States of America,2016-05-06,0,106.0,English,Released,Es gibt keine Ehre bei Rache.,Code of Honor - Rache ist sein Gesetz,4.3,83
283708,7700000,"Drama, Kriegsfilm",,283708,,fr,Loin des hommes,"1954: In Algerien brodelt eine Rebellion, die zum Krieg zwischen der algerischen Unabhängigkeitsbewegung und dem Militär der französischen Kolonialmacht führen wird. Daru, der früher in der französischen Armee diente, ist nun Französischlehrer in einem abgelegenen Dorf des algerischen Atlasgebirges. Ein Soldat fordert ihn auf, den Bauern Mohamed zur nächsten Polizeistation zu bringen – dem Mann wird vorgeworfen, ein Dissident und Mörder zu sein, ihm droht die Hinrichtung. Gemeinsam schlagen sich Daru und Mohamed durch das Gebirge, mitten im eisigen Winter, während Reiter und Dorfbewohner sie verfolgen, Blutrache im Sinn. Langsam beginnen die flüchtenden Männer, Verständnis füreinander zu entwickeln. Und schließlich muss Daru eine schwierige Wahl treffen: Er muss sich entscheiden, auf welcher Seite er beim Freiheitskampf stehen will…",8.65,"One World Films, Pathé, Perceval Pictures, Kaléo Films, Jouror Développement","France, United States of America",2015-01-14,0,101.0,"العربية, Français, Español",Released,Es gibt immer eine Wahl.,Den Menschen so fern,6.8,170
11308,7500000,"Komödie, Drama",,11308,,en,The Hotel New Hampshire,"Drama über die Familie Hampshire, das über drei Generationen angelegt ist. Die Familie Berry führt ein Hotel in den USA. Da dieses nicht so gut läuft, ziehen sie nach Europa und eröffnen erneut ein Hotel in Wien. In der dritten Generation sind sie wieder in den USA, wo es zu einem dramatischen Ende kommt.",14.773,"Orion Pictures, Woodfall Film Productions, Filmline Productions","Canada, United Kingdom, United States of America",1984-03-09,5100000,109.0,English,Released,,Das Hotel New Hampshire,5.625,120
15365,0,"Komödie, Action, Abenteuer, Krimi",,15365,,en,Witless Protection,"Die Story dreht sich um einen Kleinstadt Sheriff, der Zeuge einer Entführung wird und der entführten Frau zur Hilfe eilt. Die Kidnapper stellen sich allerdings als FBI Beamte heraus, die die Frau beschützen sollen und während sie zum einem Korruptionsprozess nach Chicago gebracht wird. Allerdings erweisen die Beamten sich als auf der Flucht befindlich und als Verbrecher die die Frau töten wollen.",5.233,Parallel Entertainment Pictures,United States of America,2008-02-22,0,97.0,English,Released,,Beschützer wider Willen,4.4,78
36046,7500000,"Drama, Liebesfilm",,36046,,en,The Work and the Glory,,2.788,Manchester Pictures,United States of America,2004-11-24,3347647,110.0,English,Released,,The Work and the Glory,6.4,15
103903,7500000,Komödie,,103903,,en,Outside Bet,,1.361,,United Kingdom,2012-04-27,0,101.0,English,Released,,Outside Bet,5.6,4
73873,8000000,Drama,http://www.pandastorm.com/detail/albert-nobbs/4647.htm,73873,,en,Albert Nobbs,"Im Irland des 19. Jahrhunderts arbeitet der introvertierte Butler Albert Nobbs im Nobelhotel der sparsamen Mrs. Baker. Diese quartiert den Maler Hubert Page in Nobbs’ Dachkammer ein – sehr zu dessen Schrecken. Denn seit Albert als 14-jährige Waise missbraucht wurde, trägt sie Männerkleider und schlägt sich als penibler, höchst zuverlässiger Diener durchs Leben. Und dann fliegt Alberts Schattenexistenz auf – wegen eines Flohs, der sich in ihr Korsett verirrt hat. Kurz darauf gibt sich auch Page als Frau zu erkennen.",11.204,"Mockingbird Pictures, Trillium Productions, Parallel Film Productions, Morrison Films, WestEnd Films, DragonCove Studios, Chrysalis Films, Allen & Associates, Canal+, Fís Éireann/Screen Ireland","United States of America, France, Ireland, United Kingdom",2011-12-21,5634828,109.0,English,Released,Der perfekte Gentleman. Das perfekte Geheimnis.,Albert Nobbs,6.341,473
312113,12500000,"Drama, Action, Krimi",,312113,,en,Black November,,5.957,Wells & Jeta Entertainment,"United States of America, Nigeria",2012-12-07,0,95.0,English,Released,,Black November,5.5,10
14165,6000000,"Familie, Komödie, Liebesfilm",,14165,,hi,Ta Ra Rum Pum,"Rajveer 'RV' Singh (Saif Ali Khan) ist Amerikas erfolgreichster NASCAR-Rennfahrer. Seine Frau Radhika (Rani Mukherji) und die beiden Kinder sind seine größten Fans. Als Rajveer nach einem traumatischen Unfall nicht mehr an seine Erfolge anknüpfen kann, wirft ihn sein Rennstall 'Speeding Saddles' raus. Die Familie ist finanziell ruiniert und muss ein neues Leben im Ghetto von New York beginnen. Um den Kindern die plötzliche Armut zu verheimlichen, behaupten sie, Teilnehmer einer Fernsehshow zu sein, bei der es darum geht, mit so wenig Geld wie möglich auszukommen. Gerade als die Familie auseinander zu brechen droht, bekommt 'RV' eine letzte große Chance, sich sein früheres Leben zurückzuerobern. Wird er sein Trauma überwinden können?",9.755,Yash Raj Films,India,2007-04-27,15242548,155.0,"English, हिन्दी",Released,,Ta Ra Rum Pum: Papa gibt Gas - Eine Familie ist nicht zu stoppen,6.1,70
