tmdb_id,budget,genres,homepage,id,keywords,original_language,original_title,overview,popularity,production_companies,production_countries,release_date,revenue,runtime,spoken_languages,status,tagline,title,vote_average,vote_count
19995,237000000,"Action, Abenteuer, Fantasy, Science Fiction",https://www.avataraufbruchnachpandora.de,19995,,en,Avatar,"Ex-Marine Jake Sully nimmt auf dem Planeten Pandora an einem Experiment unter der Leitung der Wissenschaftlerin Dr. Grace Augustine teil. Als er sich im genetisch manipulierten Körper der Ureinwohner in die schöne Neytiri verliebt, gerät er zwischen die Fronten eines skrupellosen Konzerns und dem naturverbundenen Volk der Na'vi. Jake muss sich entscheiden, auf welcher Seite er steht - in einem ungleichen Kampf, in dem es um das Schicksal einer einzigartigen Welt geht ...",145.183,"Dune Entertainment, Lightstorm Entertainment, 20th Century Fox, Ingenious Media","United States of America, United Kingdom",2009-12-15,2923706026,162.0,"English, Español",Released,Betritt die Welt von Pandora,Avatar - Aufbruch nach Pandora,7.586,31905
417859,130000000,"Animation, Familie, Fantasy, Abenteuer, Komödie",,417859,,en,Puss in Boots,"Einst war der gestiefelte Kater ein gefeierter Held, bis ihn sein ehemaliger Freund Humpdy Dumpty betrog. Seitdem wird der Kater geächtet und muss seinen Lebensunterhalt mit Diebstählen verdingen.  Bis eines Tages sein alter Freund Humpdy wieder auf der Bildfläche erscheint. Zusammen mit der Diebin Kitty Samtpfote, will er ein paar magische Bohnen stehlen und dafür brauchen sie die Hilfe des gestiefelten Katers. Da der Kater dadurch seine Schuld in seinem alten Heimatdorf wiedergutmachen könnte, steigt er bei dem Plan ein.  Dafür müssen sie zuerst die magischen Bohnen den zwei Banditen Jack und Jill entwenden, diese sollen nämlich der Schlüssel zu einem magischen Reich voller Schätze sein.",57.027,DreamWorks Animation,United States of America,2011-10-27,554987477,90.0,"Español, English",Released,Lebe für die Gefahr. Kämpfe für Gerechtigkeit. Bete um Gnade.,Der gestiefelte Kater,6.6,4121
13700,110000000,"Animation, Familie",http://disney.go.com/disneyvideos/animatedfilms/homeontherange,13700,,en,Home on the Range,"Im Wilden Westen sind die Kühe los! Als die drei Kühe Mrs. Caloway, Maggie und Grace erfahren, daß ihrw Farm ""Patch of Heaven"" wegen finanzieller Probleme geschlossen werden soll, machen sie sich zusammen mit den Bullen Boris und Noris sowie einigen anderen Tieren auf die Jagd nach Alameda Slim. Wenn sie ihn fangen und das ausgesetzte Kopfgeld kassieren können, ist die Farm gerettet!",49.143,"Walt Disney Pictures, Walt Disney Feature Animation",United States of America,2004-04-02,145358062,76.0,"普通话, English",Released,,Die Kühe sind Los!,6.1,2055
262504,110000000,"Abenteuer, Science Fiction, Action, Mystery",,262504,,en,Allegiant,"Nach den erschütternden Ereignissen sind Tris und Four gezwungen zu fliehen und die Mauern, die Chicago umschließen, hinter sich zu lassen. Damit wagen sie den ersten Schritt aus der einzigen ihnen bislang bekannten Stadt und der vertrauten Umgebung ihrer Familie und Freunde. Doch bereits kurz nach ihrer Flucht werden alle bisher gewonnenen Erkenntnisse durch die Entdeckung einer neuen, schockierenden Wahrheit zunichte gemacht. Tris und Four müssen entscheiden, wem sie in einer erbarmungslosen Schlacht, die die Existenz der gesamten Menschheit bedroht, vertrauen können. Um zu überleben, sind sie gezwungen, schier unmögliche Entscheidungen über Mut, Treue, Opfer und Liebe zu treffen.",39.721,"Mandeville Films, Summit Entertainment, Lionsgate, Red Wagon Entertainment",United States of America,2016-03-09,179246868,121.0,English,Released,Überwinde die Grenzen deiner Welt,Die Bestimmung - Allegiant,6.1,6655
257088,105000000,"Action, Abenteuer, Krimi, Thriller",,257088,,en,Point Break,"Überall auf der Welt unternimmt eine Gruppe von Kriminellen ausgeklügelte Überfälle auf große Unternehmen, die die internationalen Finanzmärkte bedrohen und sogar als Terrorakte eingestuft werden. FBI-Agent Johnny Utah ist durch die Waghalsigkeit und Dreistigkeit der Raubzüge davon überzeugt, dass ein Team von Extremsportlern hinter den Überfällen steckt. Johnnys Vorgesetzte sind zwar skeptisch, geben dem jungen Ermittler aber eine Chance und schleusen ihn undercover in die Szene ein. Bald schon macht Utah die Bekanntschaft von Bodhi, Chowder und Grommet, in denen er die Übeltäter gefunden zu haben glaubt. Johnny freundet sich mit den Adrenalinjunkies an, die ihn schließlich in ihr Geheimnis einweihen. Doch gerade der charismatische Strippenzieher Bodhi zieht Utah zusehends in seinen Bann und auch die schöne Samsara bringt seine Entschlusskraft ins Wanken. Bald ist sich Utah nicht mehr sicher, was richtig und was falsch ist.",28.72,"Studio Babelsberg, Alcon Entertainment, DMG Entertainment, Taylor-Baldecchi-Wimmer","Germany, United States of America",2015-12-03,133782481,114.0,English,Released,Geh an deine Grenzen.,Point Break,5.957,2305
258509,90000000,"Familie, Abenteuer, Komödie, Musik, Animation",,258509,,en,Alvin and the Chipmunks: The Road Chip,"Durch eine Verkettung unglücklicher Umstände kommt es den Chipmunks zu Ohren, dass Dave seiner neuen Freundin in New York einen Heiratsantrag machen will. Durch ein Missverständnis glauben die drei singenden Nager plötzlich, dass Dave seine drei tierischen Freunde gegen eine feste Beziehung mit seiner Angebeteten eintauschen – sie also loswerden – will. Kurzerhand begeben der mutige Alvin, der schlaue Simon und der kleine Theodore sich also auf einen dreitägigen Road Trip nach New York City, um die drohende Verlobung zu verhindern.",44.358,"TSG Entertainment, Fox 2000 Pictures, Regency Enterprises, Bagdasarian Productions, Sunswept Entertainment",United States of America,2015-12-17,233755553,92.0,English,Released,,Alvin und die Chipmunks - Road Chip,6.0,1646
49852,90000000,"Musik, Fantasy, Familie, Abenteuer",,49852,,en,The Nutcracker,"Wien 1920: Das langweilige Weihnachtsfest der 9-jährigen Mary verwandelt sich plötzlich in ein aufregendes Abenteuer, als ihr geliebter Onkel Albert zu Besuch kommt und ihr einen Nussknacker schenkt. Der kleine Mann aus Holz erwacht plötzlich zum Leben und die beiden begeben sich auf eine wundersame Reise, die sie in eine Welt voller Magie führt. Doch das fantastische Reich wird durch die bösen Machenschaften des Rattenkönigs bedroht und Mary und ihr außergewöhnlicher Freund müssen alles dafür tun ihn aufzuhalten..",16.685,"Vnesheconombank, Nutcracker Holdings, HCC Media Group, Russian Roulette Ltd.","United Kingdom, Hungary",2010-11-24,17177993,110.0,English,Released,,Der Nussknacker,5.1,189
39691,85000000,"Familie, Abenteuer, Komödie, Fantasy, Action, Animation",,39691,,en,Cats & Dogs: The Revenge of Kitty Galore,"Hunde und Katzen stehen seit jeher auf Kriegsfuß. Das ändert sich schlagartig, als das Kätzchen Kitty Kahlohr, Ex-Spionageagentin der Organisation MEOWS, dem Größenwahnsinn verfällt und sich mit einem teuflischen Vorhaben nicht nur die Hundewelt untertan machen will, sondern auch die eigenen Artgenossen. So schließen sich Katzen und Hunde kurzerhand zu einem Agententeam zusammen, um gegen den gemeinsamen Erzfeind vorzugehen. Schließlich ist ja auch noch das Leben ihrer Herrchen in Gefahr.",17.945,"Village Roadshow Pictures, Polymorphic Pictures, Mad Chance, CD2 Films, Warner Bros. Pictures, Warner Bros. Entertainment","United States of America, Australia",2010-07-29,112483764,79.0,English,Released,,Cats & Dogs - Die Rache der Kitty Kahlohr,5.201,643
330770,0,"Mystery, Drama, Horror",,330770,,fr,Évolution,"Der zehnjährige Nicolas (Max Brebant) lebt mit seiner Mutter in einem kleinen Dorf in einer abgelegenen Küstengemeinde. Dort wohnen allerdings nur Frauen und Jungen in seinem Alter – von älteren Männern ist keine Spur zu finden. In einem Krankenhaus am stürmischen Ozean müssen sich die Jungen regelmäßig der ärztlichen Behandlung hingeben. Ist es eine Behandlung oder sind es Experimente, die die Ärzte mit ihnen durchführen, fragt sich Nicolas. Misstrauisch geworden von der Situation um ihn herum, will er Antworten finden und folgt in einer Nacht den Frauen, die zum Strand gehen. Dort entdeckt er etwas, was einem Alptraum gleicht. Kann Nicolas entkommen?",10.16,"Les films du Worso, Noodles Production, SCOPE Pictures, Volcano Films, Left Field Ventures, Evo Films A.I.E.","Belgium, France, Spain",2016-03-16,0,81.0,Français,Released,,Evolution,6.0,206
77951,80000000,"Animation, Familie, Abenteuer",http://www.dinosaurier-3d.de/,77951,,en,Walking with Dinosaurs,"Die drei Pachyrhinosaurier Patchi, sein großer Bruder Scowler und das Weibchen Juniper werden in der gleichen Herde geboren und wachsen zusammen auf. Patchi ist der Sohn des Alphamännchens, aber auch der kleinste und schwächste von den drei Dino-Kindern. Doch gerade diese Voraussetzungen treiben ihn dazu an, seine Grenzen immer wieder auszutesten. Gemeinsam mit seinem besten Freund Alex, einem Vogel, erlebt der junge Dinosaurier allerhand Abenteuer und erkundet prähistorische Landschaften und Lebewesen. So wächst er nach und nach zu einem starken Erwachsenen heran, der die gesamte Herde auf eine nie dagewesene Wanderung führt. Während sich Juniper zu Patchis heimlicher Liebe entwickelt, wird sein großer Bruder mit der Zeit zu Patchis schärfstem Konkurrenten...",22.739,"Animal Logic, Evergreen Films, Reliance Entertainment, IM Global, BBC Earth, 20th Century Fox","Australia, India, United Kingdom, United States of America",2013-12-18,126500000,87.0,English,Released,,Dinosaurier 3D - Im Reich der Giganten,6.2,477
10197,80000000,"Drama, Musik, Liebesfilm",,10197,,en,Nine,"Das Musical ""Nine"" dreht sich um den weltberühmten italienischen Filmregisseur Guido Contini, der zwar gerade auf der Welle des Erfolgs schwimmt und seinen größten Hit auskostet, zugleich aber von einer schweren Midlifecrisis steht. Der bevorstehende 40. Geburtstag kostet ihn nicht nur Nerven und Kreativität, sonder verstrickt ihn auch noch in ein kompliziertes Netz aus Affären, Streitereien und Leidenschaft mit den Frauen in seinem Leben - mit seiner Ehefrau, seiner Geliebten, einer amerikanischen Mode-Journalistin, seiner Kostümdesignerin, einer Muse, der Verführerin aus seiner Jugend und mit seiner verstorbenen Mutter.",17.847,"Relativity Media, The Weinstein Company, Marc Platt Productions, Lucamar Productions, Weinstein Brothers Productions","Italy, United States of America",2009-12-03,53825515,118.0,"English, Français, Italiano",Released,Die Frauen meines Lebens,Nine,5.52,597
9992,86000000,"Abenteuer, Fantasy, Animation, Familie",,9992,,fr,Arthur et les Minimoys,"So hat Arthur sich die Sommerferien nicht vorgestellt: Das Grundstück seiner Großmutter ist in Gefahr und kann nur durch den Schatz seines verschwundenen Großvaters gerettet werden. Das Problem: Der Schatz ist tief unter dem Garten verborgen, in einem märchenhaften Land voll winziger Zauberwesen - und Arthur bleiben nur 48 Stunden Zeit. Durch einen Zauber schrumpft Arthur auf 2 mm Größe und gelangt in das Königreich der Minimoys. Doch damit geht das Abenteuer erst richtig los, denn das Reich wird von einem unheimlichen Tyrannen bedroht. Zum Glück stehen Arthur die Minimoy-Prinzessin Selenia und ihr Bruder zur Seite. Werden die drei den bösen Maltazard besiegen und den geheimnisvollen Schatz finden?",32.022,"EuropaCorp, Avalanche Productions, Apipoulaï Productions, Sofica EuropaCorp",France,2006-12-13,108605609,94.0,English,Released,,Arthur und die Minimoys,6.395,2892
76649,100000000,"Action, Abenteuer, Historie, Liebesfilm, Drama",,76649,,en,Pompeii,"79 nach Christus: Am Fuß des Vesuvs, einem erloschen geglaubten Vulkan, befindet sich die prächtige Stadt Pompeii. Doch eines schicksalhaften Tages bricht der Vulkan aus und verwandelt die einst blühende Stadt in eine einzige Ascheruine. Der Sklave Milo, der die Katastrophe von einem Schiff aus beobachten konnte, entsagt seinem Herrn Lucretius und macht sich auf, seine große Liebe Cassia und seinen besten Freund zu suchen und mit ihnen zu fliehen.",33.683,"Don Carmody Productions, Impact Pictures, Constantin Film, FilmDistrict, TriStar Pictures","Canada, Germany, United Kingdom, United States of America",2014-02-18,117831631,105.0,English,Released,"Keine Warnung, kein entkommen",Pompeii,5.538,3245
293644,8000000,"Komödie, Animation, Familie",,293644,,es,Don Gato: El Inicio de la Pandilla,,9.539,"Ánima Estudios, Discreet Arts Productions","India, Mexico",2015-10-30,4668442,89.0,"English, Español",Released,,Don Gato: El Inicio de la Pandilla,6.7,146
15189,35000000,"Komödie, Familie",,15189,,en,Hotel for Dogs,"Andis Pflegeeltern dulden unglücklicherweise keine Tiere in ihrem Haus. Das zwingt sie und ihren kleinen Bruder Bruce, die liebevollen Herrchen ihres Hündchens Freitag, zu einer schnellen Lösung des Problems. Die ist auch bald gefunden, in einem verlassenen Hotel in der Stadt.",18.437,"DreamWorks Pictures, Nickelodeon Movies, Cold Spring Pictures, The Donners' Company, The Montecito Picture Company",United States of America,2009-01-16,117000198,100.0,English,Released,,Das Hundehotel,6.0,868
25769,0,"Action, Drama, Horror, Science Fiction, Thriller",,25769,,en,Carriers,"Ein Virus ist mutiert und hat die Menschen befallen. Eine Heilung ist nicht in Sicht. Die Epidemie hat fast die ganze Menschheit ausgelöscht. Niemand ist sicher und niemandem kann man trauen, denn die Ansteckungsgefahr ist allgegenwärtig. In dieser dramatischen Situation machen sich vier junge Freunde auf den Weg zu einem abgelegenen Strand, um das Ende der Seuche abzuwarten: Brian, dessen jüngerer Bruder Danny, Brians Freundin Bobby und Dannys Schulfreundin Kate. Als sie auf ein liegengebliebenes Auto stoßen, wissen sie nicht, dass sie damit ihr Schicksal besiegelt haben. Ihre Reise in den Süden wird zu einem tödlichen Kampf gegen gefährliche Infizierte, wahnsinnig gewordene Überlebende, tollwütige Hunde – und schließlich gegeneinander.",30.461,"Paramount Vantage, Likely Story, This is that, Ivy Boy Productions",United States of America,2009-09-04,5805279,85.0,English,Released,Flucht vor der tödlichen Seuche,Carriers,6.1,1398
228165,74000000,"Familie, Abenteuer, Komödie, Fantasy, Animation",,228165,,en,The SpongeBob Movie: Sponge Out of Water,"Als der fiese Pirat Burger Beard Mr. Krabs' Geheimrezept für den allseits beliebten Krabbenburger stiehlt, stürzt er damit die gesamte Unterwasser-Stadt Bikini Bottom ins Chaos. Das wollen deren Bewohner natürlich nicht auf sich sitzen lassen. Und so begeben sich SpongeBob und seine Freunde Patrick, Sandy, Thaddäus und Mr. Krabs in die Welt der Menschen, um Burger Beard mit vereinten Kräften das Handwerk zu legen. Doch auch SpongeBobs Erzfeind Plankton will die Gelegenheit nutzen, um an das Rezept zu kommen. Während sie sich noch in der ihnen fremden Welt zurechtfinden müssen, wecken sie bald erstaunliche Kräfte in sich, mit denen sie Burger Beard und seiner finsteren Crew entschlossen entgegentreten.",52.43,"Paramount Animation, Paramount Pictures, Nickelodeon Movies, United Plankton Pictures, Film Victoria, Rough Draft Studios, Disruption Entertainment","Australia, United States of America",2015-01-28,311594032,93.0,English,Released,Schwamm aus dem Wasser,SpongeBob Schwammkopf,6.092,2370
59981,70000000,"Animation, Familie, Fantasy",,59981,,en,Legends of Oz: Dorothy's Return,"Die junge Dorothy Gale kehrt in ihre Heimat Kansas zurück und muss mit Entsetzen feststellen, dass sie von dem Tornado, der das Mädchen vor wenigen Tagen in die fantastische Welt von Oz gebracht hatte, völlig zerstört wurde. Die Leute packen ihre Sachen und ziehen in andere Gebiete des Landes. Auf magische Weise wird Dorothy kurz darauf zurück nach Oz transportiert, wo sie erfährt, dass das zauberhafte Land in Gefahr ist und die Bewohner ihre Hilfe brauchen: Der verrückte Jester versucht Oz zu unterjochen und verwandelt lebendige Wesen in leblose Puppen. Dorothys Freunde, die Vogelscheuche, der Blechmann und der Löwe, sind verschwunden und Dorothy begibt sich auf die Suche nach ihnen.",14.975,"Summertime Entertainment, Prana Animation Studios","India, United States of America",2014-05-08,18662027,88.0,English,Released,,Die Legende von Oz - Dorothys Rückkehr,6.3,367
188207,70000000,"Action, Abenteuer",http://www.Hercules3DMovie.com,188207,,en,The Legend of Hercules,"Das antike Griechenland im Jahre 1200 v. Chr.: Hercules ist das Kind des Göttervaters Zeus und einer menschlichen Königin, die dessen Charme erlag. Hercules weiß jedoch nichts von seiner Herkunft, seiner Identität und auch nicht davon, dass er dazu bestimmt ist, der Herrschaft des tyrannischen Königs ein Ende zu bereiten. Es beschäftigt ihn nur die Liebe zu Hebe, der Prinzessin von Kreta, die jedoch seinem Bruder versprochen wird. Hercules wird schließlich mit seinem wahren Schicksal und seiner Bestimmung als Held konfrontiert. Soll er den für ihn bestimmten Weg gehen, sein Land befreien und zum großen Helden werden? Oder soll er mit seiner geliebten Hebe vor allen Konventionen fliehen, sein Land im Stich lassen und ein Leben im Exil führen?",24.272,"Millennium Media, Summit Entertainment, Nu Boyana Film Studios","Bulgaria, United States of America",2014-01-10,61279452,99.0,English,Released,Jeder Mensch hat ein Schicksal.,The Legend of Hercules,4.8,1331
196867,65000000,"Komödie, Drama, Familie",,196867,,en,Annie,"Annie ist ein Waisenmädchen in New York, das mit der temperamentvollen Miss Hannigan als Pflegemutter ein schweres Los gezogenen hat. Ausgestattet mit einer schlagfertigen, optimistischen Art versucht das junge Mädchen jedoch so gut es geht, ihr schwieriges Leben zu meistern. Doch dann will sich der milliardenschwere Unternehmer und angehende Politiker Will Stacks im Wahlkampf um das Amt des New Yorker Bürgermeisters als selbstlos und kinderliebend inszenieren – und adoptiert Annie kurzerhand, was ihren Alltag genauso plötzlich wie mächtig auf den Kopf stellt. Stacks betrachtet sich selbst als Annies großer Retter. Dabei ist sie es, deren Selbstbewusstsein und lebensbejahende Einstellung sich schon bald sehr positiv auf den knallharten Karrierepolitiker auswirken…",36.546,"Marcy Media, Columbia Pictures, Olive Bridge Entertainment, Overbrook Entertainment",United States of America,2014-12-18,136853506,118.0,English,Released,,Annie,6.2,1283
10783,65000000,"Komödie, Krimi",,10783,,en,Lucky Numbers,"Der in finanzielle Schwierigkeiten geratene Meteorologe und Star der Wetternachrichten Russ Richards muss dringend an Geld kommen. Was liegt da näher, als die Lotterieziehung zu manipulieren, die im gleich Studio stattfindet, in dem auch seine Wettershow aufgenommen wird.",12.24,"Paramount Pictures, StudioCanal, Jonathan D. Krane Productions, Mad Chance, Alphaville Films","France, United States of America",2000-10-27,0,105.0,English,Released,,Lucky Numbers,5.1,182
16577,10000000,"Animation, Action, Familie, Science Fiction",,16577,,en,Astro Boy,"Nach dem Tod seines Sohnes entwickelt der Wissenschaftler Dr. Tenma einen Roboter mit Superkräften, der seinem Jungen sehr ähnlich sieht. Er wird damit aber auf Dauer nicht fertig und verstößt ihn. Damit beginnt für Astro Boy das größte Abenteuer seines Lebens.",20.377,"Summit Entertainment, Imagi Animation Studios, Tezuka Productions","Hong Kong, Japan, United States of America",2009-10-15,19551067,94.0,English,Released,,Astro Boy,6.3,1537
13576,60000000,"Musik, Dokumentarfilm",,13576,,en,This Is It,"Michael Jackson, der King of Pop, arbeitete vier Jahre an der Realisierung von This Is It, gemeinsam mit dem Choreographen Travis Payne, mit dem er seit zwanzig Jahren zusammenarbeitete. Die Konzertserie This Is It in der Londoner O₂Arena würden seine letzten Auftritte sein. Aufgrund der großen Nachfrage wurde die Konzertreihe von geplanten 10 Konzerten um 40 weitere Termine erhöht. 1.000.000 Tickets wurden binnen weniger als sechs Stunden verkauft. Am 25. Juni 2009 verstarb Michael Jackson auf tragische Art und Weise etwa 3 Wochen vor Beginn der Konzerte. This is it gewährt einen seltenen Einblick in sein Leben als Künstler, während er die Show entwickelte, kreierte und probte. Die Chronik wurde aus über 100 Stunden Filmmaterial zusammengeschnitten, das ihn bei den Proben zeigt. Der Film hält den Sänger, Tänzer, Filmemacher, das kreative Genie und den großartigen Künstler fest, während er seine letzten Shows perfektionierte. Es ist der erfolgreichste Konzertfilm aller Zeiten.",13.669,"Columbia Pictures, AEG Live, The Michael Jackson Company",United States of America,2009-10-28,261200000,107.0,English,Released,,This Is It,7.186,921
170687,60000000,"Animation, Komödie, Familie, Fantasy",,170687,,en,The Boxtrolls,"Die unter den Straßen der Stadt Cheesebridge hausenden Boxtrolls werden von den menschlichen Bewohnern der Oberfläche gefürchtet. Da die in Pappkartons lebenden Monster nur nachts ihre unterirdische Heimat verlassen, um in den Abfällen der Menschen nach allerlei Interessantem zu suchen, ranken sich viele Schauergeschichten um die Boxtrolls. In Wirklichkeit handelt es sich bei den Kreaturen um zwar nicht sehr reinliche, dafür aber umso liebenswürdigere, kleine und scheue Gesellen. Vor Jahren haben die Boxtrolls den Waisenjungen Eggs bei sich aufgenommen und ihn zu einem Bestandteil ihrer Gruppe gemacht. Als der verschlagene Archibald Snatcher die Boxtrolls endgültig vertreiben möchte, muss Eggs seine Familie verteidigen. Hilfe von den Menschen kann er nur in Form der quirligen Winnifred erwarten.",19.715,Laika,United States of America,2014-09-10,108255770,97.0,English,Released,,Die Boxtrolls,6.696,1689
87825,60000000,"Drama, Liebesfilm",,87825,,en,Trouble with the Curve,"Gus Lobel zählt seit Jahrzehnten zu den besten Baseball-Talentsuchern – allein anhand des Schlägergeräuschs kann er die Qualität eines Schlags beurteilen. Doch obwohl er es nicht wahrhaben will – sein Alter lässt sich mittlerweile nicht mehr verleugnen. Die Teamleitung der Atlanta Braves wundert sich zunehmend über seine Entscheidungen, zumal die Verhandlungen um den phänomenalsten Nachwuchs-Schlagmann der USA anstehen. Helfen könnte in dieser Situation nur die einzige Person, die Gus niemals bitten würde – seine Tochter Mickey: Die dynamische und ehrgeizige Anwältin steht kurz davor, in ihrer hochkarätigen Kanzlei zur Partnerin aufzusteigen. Mickey hat sich mit ihrem Vater nie verstanden, denn nach dem Tod seiner Frau hat er als alleinerziehender Vater kläglich versagt. Selbst jetzt, bei ihren seltenen Treffen, lässt er sich ständig ablenken – Mickey glaubt den Grund zu kennen: Baseball geht ihm eben über alles.",87.723,"Malpaso Productions, Warner Bros. Pictures",United States of America,2012-09-21,49000000,111.0,English,Released,Eine neue Chance,Back in the Game,6.989,1599
12201,80000000,"Krimi, Drama, Mystery, Thriller",,12201,,en,Edge of Darkness,"Gerade erst konnte der Bostoner Cop und alleinstehende Witwer Thomas Craven seine 24-jährigen Tochter Emma bei ihrem ersten Besuch seit Jahren wieder in die Arme schließen, da muss er mit ansehen, wie sie von einem Unbekannten erschossen wird. Während die Polizei vermutet, der Schuss habe eigentlich ihm gegolten, verfolgt Craven eine andere Theorie und ermittelt auf eigene Faust. Schnell findet Craven heraus, dass Emma geheime Informationen über ihren Arbeitgeber Northmoor besaß, und gerät damit selbst ins Fadenkreuz.",17.485,"Icon Productions, GK Films, BBC Film, Warner Bros. Pictures","United Kingdom, United States of America",2010-01-28,81126522,117.0,English,Released,Nur wenige entkommen der Gerechtigkeit. Keiner entkommt der Rache.,Auftrag Rache,6.349,1546
123553,60000000,"Fantasy, Action, Mystery",,123553,,en,The Mortal Instruments: City of Bones,"Gerade noch war Clary ein typischer Teenager mit familiären Kommunikationsstörungen und einer starken Bindung zu ihrem besten Freund Simon. Doch als Dämonen ihre Mutter entführen, entdeckt Clary eine unbekannte, gefährliche Welt und die Lüge ihres bisherigen Lebens. Von ihrem neuen Beschützer, dem Schattenjäger Jace, erfährt Clary, dass ihre Mutter sie nicht grundlos täuschte, sie dazu bestimmt ist, Dämonen zu jagen und den Schlüssel in sich trägt, mit ihren großen Kräften die geschwächten Schattenjäger wieder zu stärken.",39.75,"Screen Gems, Unique Features, Mister Smith Entertainment, Don Carmody Productions, Constantin Film","Canada, Germany, United Kingdom, United States of America",2013-08-21,95396573,130.0,English,Released,"Es gibt eine verborgene Welt, in unserer eigenen.",Chroniken der Unterwelt - City of Bones,6.441,4469
381902,68490000,"Action, Abenteuer, Fantasy",,381902,,zh,西遊記之孫悟空三打白骨精,"500 Jahre nach den Verwüstungen im Himmel wird der Tang-Priester von Buddha beauftragt, in den Westen zu gehen, um die heiligen Schriften zu holen, nur um aus Versehen den Affenkönig zu befreien. Da Lady White (Gong Li) das Team, das sie besiegen sollte, auflösen will, muss der Affenkönig kämpfen, um seine Welt zu retten!",20.863,Filmko Pictures,"Hong Kong, China",2016-01-22,193677158,120.0,普通话,Released,,Der Affenkönig 2,5.9,98
