tmdb_id,budget,genres,homepage,id,keywords,original_language,original_title,overview,popularity,production_companies,production_countries,release_date,revenue,runtime,spoken_languages,status,tagline,title,vote_average,vote_count
42889,2000000,Komödie,,42889,,en,The Virginity Hit,"Vier Jungs, eine Videokamera und zu viel Freizeit: Diese Komödie begleitet denTeenager Matt auf seiner Mission, seine Jungfräulichkeit zu verlieren. Matt ist dereinzige unter seinen Freunden, der es noch nicht getan hat. Er war zwar kurz davor,doch dann fand er heraus, dass seine Freundin ihn betrogen hat. Nun ist es ihmwichtiger als je zuvor, endlich zum Zuge zu kommen...",8.403,"Gary Sanchez Productions, Principato-Young Entertainment",United States of America,2010-09-24,636706,88.0,English,Released,,The Virginity Hit,4.4,72
24363,6000000,"Komödie, Drama",,24363,,en,House of D,"Illustrator Tommy lebt mit Frau und Sohn in Paris. Sein Alltag ist ziemlich chaotisch, und als ihm klar wird, dass die Ursachen dafür wohl in seiner konfusen Vergangenheit liegen, beginnt er, sich mit der Geschichte seiner Kindheit im New Yorker Greenwich Village zu beschäftigen. Dort versucht er sich als 13-Jähriger mit Blödeleien in der katholischen Schule über den Verlust des Vaters zu trösten und seine Mutter wenigstens ab und zu zum Lachen zu bringen. Halt gibt ihm die Freundschaft mit dem zurückgebliebenen Hausmeister Pappass, mit dem zusammen er Botendienste für einen Fleischer erledigt. Er erlebt seine erste Liebe und macht die Bekanntschaft von Lady Bernadette, die im „House Of D"" einsitzt – ein Gefängnis, dessen Insassen mit den Passanten auf der Straße sprechen können. Es ist vor allem ein tragisches Ereignis seiner Kindheit, das ihn als Erwachsener nicht los lässt, bis er mit seiner Familie nach New York zurück kehrt, um endlich ein paar Dinge abzuschließen.",9.198,"Lions Gate Films, Bob Yari Productions, Jeff Skoll Productions, Southpaw Entertainment, Tribeca Productions",United States of America,2004-05-07,389866,92.0,"English, Français",Released,,House of D,6.3,143
325140,0,"Liebesfilm, Thriller",,325140,,hi,Hum To Mohabbat Karega,,1.105,,,2000-05-26,0,148.0,हिन्दी,Released,,Hum To Mohabbat Karega,3.5,2
27023,3800000,Komödie,,27023,,en,Saint John of Las Vegas,,4.273,,United States of America,2010-01-29,111731,84.0,English,Released,,Saint John of Las Vegas,5.8,48
22913,0,Drama,,22913,,en,TwentyFourSeven,"Twenty Four Seven"" Kickern, kloppen, kiffen. 24 Stunden am Tag, sieben Tage die Woche. So sieht das trostlose Leben der Jugendlichen in einer englischen Kleinstadt aus. Der unverbesserliche Idealist Alan Darcy sieht nur eine Chance, die Kids von der Straße wegzukommen: Er gründet einen Boxclub. Hier sollen seine Schützlinge lernen, ihre Zeit endlich sinnvoll zu nutzen und sich selbst zu achten. Die Jugendlichen sind zunächst begeistert. Doch das Leben ist härter als jeder Boxkampf - und in einem Schwarz-Weiß-Film ist das Ende selten rosarot. Kleines, dreckiges Milieuporträt mit einem hochmotivierten Bob Hoskins als Boxtrainer und Sozialarbeiter.",2.218,Scala Films,United Kingdom,1997-08-31,0,91.0,English,Released,,TwentyFourSeven,6.2,34
20653,7000000,"Animation, Familie, Abenteuer, Komödie",,20653,,en,Roadside Romeo,,5.405,"Yash Raj Films, Disney World Cinema","India, United States of America",2008-10-24,1100000,92.0,हिन्दी,Released,,Roadside Romeo,4.4,33
67373,0,"Drama, Action, Thriller",,67373,,en,This Thing of Ours,,3.008,,United States of America,2005-01-01,0,100.0,,Released,,This Thing of Ours,4.0,4
171759,0,"Abenteuer, Familie",,171759,,en,The Lost Medallion: The Adventures of Billy Stone,"Der Archäologe Michael Stone sucht schon sein ganzes Leben nach einem mysteriösen verschollenen Medaillon. Sein Sohn Billy ist mittlerweile auch im Bann des Schmuckstücks und findet es mit seiner besten Freundin Allie dann auch tatsächlich auf Aumakua Island. Doch plötzlich werden die Zwei in der Zeit zurück geworfen und landen in einem Zeitalter, in dem ein düsterer Krieger die Macht des Medaillons für sich ausnutzen will.",9.505,Kaos Entertainment,United States of America,2013-03-01,0,98.0,"English, Deutsch",Released,Die Erkenntnis ist nur der Anfang.,Das verschollene Medaillon - Die Abenteuer des Billy Stone,5.3,46
35219,0,"Komödie, Drama, Mystery, Thriller",,35219,,en,The Missing Person,,5.125,"The 7th Floor, Apropos Films, Strand Releasing",United States of America,2009-01-16,0,95.0,English,Released,,The Missing Person,5.6,36
28260,2000000,"Horror, Liebesfilm",,28260,,en,Return of the Living Dead III,"Julie und Curt brechen in ein geheimes Armeeversuchsgelände ein, in dem Curts Vater aminösen Experimenten mit dem Ziel, Tote ins Leben zurückzurufen, nachgeht. Als Julie kurze Zeit später bei einem Motorradunfall ums Leben kommt, sieht Curt nur einen einzigen Ausweg: er reanimiert ihre Leiche im Labor seines Vaters…",19.199,"Ozla Productions, Bandai Visual","United States of America, Japan",1993-10-01,54207,97.0,"Español, English",Released,Tote sollte man nicht wecken,Return of the Living Dead III,6.555,847
335866,0,"Science Fiction, Mystery, Drama, Thriller, Horror",,335866,,en,Circle,"In dem Horrorfilm Circle von Aaron Hann und Mario Miscione werden 50 sich völlig fremde Menschen in einem mysteriösen Raum festgehalten. Ihnen allen droht der Tod. Gemeinsam sollen sie entscheiden, wer es verdient hat, zu überleben, denn eine Person soll verschont werden. Ein Kampf ums Überleben beginnt und jeder ist sich selbst der nächste.",18.983,"Votiv Films, Taggart Productions, Felt Films",United States of America,2015-05-28,0,86.0,English,Released,,Der Kreis,6.02,1983
215881,0,Thriller,,215881,,en,Plush,"Hayley ist die Frontfrau einer erfolgreichen Rockband, die sie zusammen mit ihrem Bruder gegründet hat. Jack ist Gitarrist der Band und mit ihm zusammen schrieb sie die meisten ihrer Songs. Eines Tages stirbt er jedoch an einer Überdosis Heroin und Hayleys Welt fällt plötzlich in sich zusammen. Damit die Band den Verlust überlebt, heuert ihr Manager den jungen Enzo als Jacks Ersatz an. Ganz langsam kommt Hayley wieder auf die Beine und die musikalischen Vorschläge des Neuzugangs erweitern das Repertoire der Band erheblich, auch wenn es bei den Fans nicht sonderlich gut ankommt. Obwohl Hayley glücklich verheiratet ist und mit ihrem Mann Carter zwei Kinder hat, beginnt sie auf einer Tour eine Affäre mit Enzo. Doch ihm reicht das nicht aus. Er taucht bei ihr Zuhause auf, spielt mit ihren Kindern und musiziert zusammen mit ihrem Mann. Als Hayley die Affäre endgültig beenden will, gerät die Situation außer Kontrolle...",10.27,"Reliance, Blumhouse Productions, IM Global Octane",United States of America,2013-09-13,0,99.0,English,Released,,Plush,5.6,104
18238,0,"Horror, Komödie",,18238,,en,Lesbian Vampire Killers,"Es läuft gerade nicht rund für die Kumpels Fletch und Jimmy. Der eine verliert seinen Job als Kinderclown, weil er einem Hosenmatz eine runtergehauen hat, der andere wurde nun zum x-ten mal von seiner Freundin abserviert. Zeit für einen Tapetenwechsel: Die zwei machen sich auf den Weg in ein kleines walisisches Nest um endlich abzuschalten. Was die beiden leider nicht wissen: Über ihrem Feriendomizil lastet ein Jahrhundertealter Fluch, der die jungen Frauen des Dorfs in lesbische Vampire verwandelt. Und diese haben richtig Durst.",10.54,AV Pictures,United Kingdom,2009-03-16,0,86.0,English,Released,Bis(s) zur Morgenlatte,Lesbian Vampire Killers,5.242,389
22600,0,"Action, Krimi, Drama",,22600,,en,Jerusalema,"Im Südafrika des späten 20. Jahrhunderts wandelt sich das Apartheidregime zur Demokratie, doch der junge Lucky Kunene kann sich trotzdem kein Studium leisten, obwohl er die passenden Noten dafür mit von der Schule brächte. Also verlegt er sich mit seinem Kumpel aufs Carjacking und stiehlt den weißen Pfeffersäcken die Daimlers unter dem Allerwertesten weg. Nach einem Umweg über ein Taxiunternehmen kommt er auf die Masche, ganze Häuser zu stehlen und gewinnbringend weiterzuvermieten. Doch Luckys Glück währt nicht ewig.",9.83,Muti Films,South Africa,2008-02-11,0,119.0,"Afrikaans, English",Released,,Gangster's Paradise: Jerusalema,6.8,58
12612,0,"Thriller, Drama, Krimi",,12612,,en,Freeze Frame,"“Freeze Frame” erzählt die Geschichte von Sean Veil, der sich selbst rund um die Uhr filmt, um im Fall, dass er eines Verbrechens beschuldigt wird, ein Alibi zu haben. Es wäre nicht das erste Mal, schon vor einigen Jahren wurde er fälschlicherweise beschuldigt, eine ganze Familie getötet zu haben. Als dann eines Tages tatsächlich eintritt, dass er wieder ein Verdächtiger der Polizei ist, ist dann aber das eine Videoband, das seine Unschuld beweisen könnte, auf unerklärliche Weise verschwunden.",3.341,,"United Kingdom, Ireland",2004-05-01,0,99.0,English,Released,,Freeze Frame,6.2,58
115210,100000,Horror,,115210,,en,Stitches,"Richard ""Stitches"" Grindle ist ein runtergekommener Clown, der auf Kindergeburtstagen auftritt und derbe Witze reißt, die so gar nichts für Kinder sind. Auf einer besonders wilden Geburtstagsparty kommt er bei einem Unfall ums Leben. Jahre später sind die Geburtstagskinder schon Teenager und auf einer Party erscheint ein ungebetener Ehrengast: Stitches ist zurück, um seinen unerwarteten Tod zu rächen.",10.593,"Tailored Films, Fantastic Films, Solid Entertainment","Ireland, United States of America",2012-10-05,95000,86.0,English,Released,,Stitches - Böser Clown,6.3,417
34335,2000000,"Krimi, Horror, Mystery",,34335,,en,Nine Dead,"“Ich habe euch aus einem guten Grund hier hergebracht: Euer Überleben hängt davon ab, dass ihr diesen Grund herausfindet. Ihr könnt nun darüber sprechen, aber in zehn Minuten komme ich zurück. Und ich werde einen von euch töten. Das wiederholen wir, bis ihr mir sagen könnt, warum ihr hier seid – oder bis ihr alle tot seid!” – Mit diesen Worten lässt der Unbekannte neun Menschen in einem Bunker allein. In ihrer Todesangst gestehen die Männer und Frauen – darunter ein Schauspieler, eine Staatsanwalt, ein Polizist und eine Schauspielerin – sich ihre tiefsten und dreckigsten Geheimnisse, hoffend, dass in ihnen die Verbindung zwischen ihnen allen zu finden ist. Die Zeit verrinnt. Zehn Minuten sind vorüber. Der große Unbekannte kommt zurück. Er hat eine Waffe. Er tötet den ersten. Und das Spiel beginnt erneut…",8.611,"Louisiana Media Productions, Hartbreak Films",United States of America,2010-03-09,0,84.0,"English, ",Released,Alle 10 Minuten muss jemand sterben...,Nine Dead,5.2,287
459488,0,"Dokumentarfilm, Musik",,459488,,en,To Be Frank: Sinatra at 100,,4.724,Eyeline Entertainment,United Kingdom,2015-12-12,0,81.0,English,Released,,To Be Frank: Sinatra at 100,7.0,7
119458,500000,"Thriller, Drama",,119458,,en,Supercapitalist,"Conner Lee, aufstrebender amerikanischer Wertpapierhändler chinesischer Herkunft, wird von seinem väterlichen Mentor, dem berüchtigten Hedgefondsmanager Petterson, von New York nach Hongkong gesandt, um die Übernahme einer chinesischen Firma in die Wege zu leiten. In Hongkong wird der mit der alten Heimat fremdelnde Conner zunächst von Kollegen in die Wonnen des dortigen Yuppie-Lifestyles eingeführt, um sodann von einer hübschen Journalistin zu erfahren, welche Verbrechen gegenüber seiner Kultur er begeht.",1.185,"Gravitas Ventures, Random Art Workshop","United States of America, Hong Kong",2012-08-10,15919,103.0,"English, 广州话 / 廣州話",Released,,The Supercapitalist,4.0,8
20406,0,"Action, Abenteuer, Drama",,20406,,en,Rockaway,"Der im Afghanistan-Krieg ausgezeichnete Soldat Trane kehrt in die Vereinigten Staaten zurück. Dort erfährt er, dass seine Familie nach Übernahme seines Wohnviertels von der russischen Drogenmafia brutal ermordet worden sind. Seine Schwaster Caridad wird gezwungen, als Callgirl zu arbeiten, während sein bester Freund Dave seinen gesamtent Besitz verloren hat. Trane schwört Rache und schmiedet einen Plan, um die Verantwortlichen auf grausamste Weise bestrafen zu können.",1.154,"Rockaway the Movie, Off Hollywood Pictures, Panamax Films, Crook Brothers Productions",United States of America,2007-07-07,0,78.0,"English, Español, Deutsch, Pусский",Released,,Rockaway,5.1,6
18616,2000000,"Horror, Thriller",,18616,,en,No Man's Land: The Rise of Reeker,"1978 geht in der Einöde des Death Valleys ein Killer auf den einsamen Straßen um, der die Leichen danach bei sich in seinem abgelegenen Haus stapelt. Nach einem weiteren Mord wird er vom Polizisten Reed verfolgt und gefangen genommen, bevor er anschließend in die Gaskammer kommt. In der Gegenwart steht das Diner ""6 Corners"" nahe dem Haus des damaligen Killers. Sheriff Reed will heute seinem Sohn Harris die Arbeit hier zeigen, da es für ihn der letzte und für Harris der erste Tag im Job ist. Doch anstatt einen ruhigen letzten Tag zu verbringen, stehen plötzlich drei Casinoräuber, Binky, der verletzte Carlos, und der Exfreund der Kellnerin Maya, Alex, vor der Tür. Auf Grund von Harris' engagiertem Vorgehen kommt es schnell zu einer Schießerei, bei der das Fluchtauto explodiert. Allerdings tauchen auch nach einiger Zeit die angeforderten Krankenwagen, Verstärkung und Feuerwehr nicht auf. Zudem haben jegliche Kommunikationsmittel den Geist aufgegeben.",7.815,"Institution, The",United States of America,2008-05-01,0,88.0,English,Released,,No Man's Land: The Rise of Reeker,4.7,72
18808,14000000,"Action, Abenteuer, Drama",,18808,,en,Highway,"Las Vegas, 1994: Jack Hayes (Jared Leto) und Pilot Kelson (Jake Gyllenhaal) sind auf der Flucht vor Gangstern und wollen sich nach Seattle absetzen, wo sie sich plötzlich mitten unter Tausenden von Nirvana-Fans wiederfinden, die um Kurt Cobain trauern…",8.339,Alex Entertainment Inc.,United States of America,2002-03-26,0,97.0,English,Released,,Highway,5.5,131
95755,2000000,"Komödie, Krimi, Drama",,95755,,en,Small Apartments,"Dafür, dass er am liebsten den ganzen Tag lethargisch in seinem abgerissenen Apartmentblock hockt und die asozialen Nachbarn ausspäht, ist plötzlich ganz schön was los im Leben der dicken, dreiunddreißigjährigen Jungfrau Franklin Franklin (kein Druckfehler). Weil Franklin nämlich versehentlich den Vermieter ins Jenseits beförderte. Noch liegt der Vermieter in seiner Wohnung, und müsste doch dringend unter die Erde. Also muss Franklin improvisieren, was bei seiner unterentwickelten Sozialkompetenz zu Verwicklungen führt.",10.231,"1812 Productions, Morocco Junction Pictures, Deviant Films, Amuse Pictures, Franchise Pictures","United States of America, Canada",2012-03-10,0,97.0,English,Released,,Small Apartments,5.9,150
188652,0,"Komödie, Fantasy, Musik, Science Fiction",,188652,,en,The Ghastly Love of Johnny X,,1.636,,,2012-03-06,0,106.0,English,Released,,The Ghastly Love of Johnny X,6.2,14
12602,0,"Horror, Mystery",,12602,,de,Die Schlangengrube und das Pendel,"Im Jahr 1801 wird Graf Regula wegen Mord an zwölf Jungfrauen gevierteilt. Jahre später reisen Baronesse Lilian von Brabant, die ein Erbe antreten soll, und Anwalt Roger von Marienburg ins Sandertal zum Schloss des Grafen. Der wird von seinem Diener wieder zum Leben erweckt und braucht das Blut der jungfräulichen Baronesse, um ewiges Leben zu erlangen. Roger, Nachfahr des Richters, der Regula verurteilte, wird in der Folterkammer unter ein riesiges Pendel gelegt. Mit Hilfe eines Kreuzes kann sich Roger befreien, Lilian retten und Regula vernichten.",6.961,Constantin Film,Germany,1967-10-05,0,85.0,Deutsch,Released,Die Reise in das Land des Grauens!,Die Schlangengrube und das Pendel,6.5,72
153795,2000000,"Komödie, Drama",,153795,,en,Straight A's,"Nachdem der Geist seiner verstorbenen Mutter ihn dazu gedrängt hat, zurück zu seiner Familie zu gehen, packt ein ehemaliger Drogensüchtiger einen Tasche voller Pillen und einen Sack voller Marijuana ein und macht sich auf den Weg in seine Heimatstadt.",6.067,"Nu Image, The Group Films, Millennium Media",United States of America,2013-01-16,61669,88.0,English,Released,,Straight A's - Jede Familie hat ein schwarzes Schaf,5.2,131
13516,0,Dokumentarfilm,,13516,,en,Slacker Uprising,,3.072,"Dog Eat Dog Films, Westside Productions",United States of America,2007-09-07,0,97.0,English,Released,,Slacker Uprising,5.4,38
98549,0,"Western, Action, Abenteuer, Historie",,98549,,en,The Legend of Hell's Gate: An American Conspiracy,,3.226,"Silver Sail Entertainment, 4Go West Productions, Flatiron Pictures",United States of America,2011-03-03,0,108.0,"English, Français",Released,,The Legend of Hell's Gate: An American Conspiracy,4.4,17
312793,0,"Komödie, Horror",,312793,,en,The Walking Deceased,"Vor einem Monat ist eine Zombieseuche ausgebrochen, die aggressiv um sich greift. Sheriff Lincoln hat davon nichts mitbekommen, er lag für sechs Wochen im Koma und bemerkt nach dem Aufwachen auf brutale Art, dass die Welt nicht mehr dieselbe ist. Er schließt sich mit anderen zu einer Gruppe zusammen, der auch sein zehnjähriger Sohn sowie vier Leute, die die Namen ihrer Lieblingsorte tragen, angehören: Green Bay, Chicago, Brooklyn und Harlem. Ebenfalls dabei: Romeo – ein Zombie, der die Menschen davon überzeugen konnte, kein Untoter zu sein, sondern lediglich etwas langsam. Die Gruppe muss ihr provisorisches Camp im Einkaufszentrum verlassen und macht sich auf den Weg zu einem angeblich sicheren Ort…",9.064,Splendid Film,United States of America,2015-03-20,0,88.0,English,Released,Die Nacht der lebenden Idioten,The Walking Deceased,5.181,185
309919,2000000,"Thriller, Mystery, Horror, Drama",,309919,,en,The Curse of Downers Grove,"Die Highschool in dem beschaulichen Ort Downers Grove wird von einem fürchterlichen Fluch befallen.  Jedes Jahr kommt ein Schüler der Abschlussklasse auf brutale Art und Weise ums Leben. Die diesjährige  Absolventin Chrissie sieht die Sache skeptisch, denn an etwas Übernatürliches will  sie nicht glauben. Auch ihre Mitschüler sehen in der Geschichte eher ein Horror-Märchen als eine reale  Bedrohung. Ihre Freundin Tracy hingegen ist von der panischen Angst befallen, dass  der Fluch als nächstes sie treffen könnte und will aus diesem Grund sogar kurzerhand ihre Sachen packen  und die Stadt verlassen. Als dann tatsächlich ein Schulkamerad auf fürchterliche Weise zu Tode stürzt,  ist Tracy davon überzeugt, dass der Fluch ein neues Opfer gefordert hat. Und jetzt verliert auch Chrissie  allmählich die Nerven: Die letzten Tage vor ihrem Abschluss werden zu einem paranoiden Höllentrip. Ist  die Jugendliche todgeweiht?",6.77,"Myriad Pictures, AliBella Pictures, Bystander Films, Management Production Entertainment (MPE), Mangrove Media",United States of America,2015-08-21,0,89.0,English,Released,Du kannst ihm nicht entkommen,Der Fluch von Downers Grove,4.8,66
299553,2000000,Thriller,,299553,,en,Shark Lake,"Clint Gray ist gerade wieder mal auf Bewährung aus dem Gefängnis entlassen worden, als sich im See der idyllischen Kleinstadt Lake Tahoe blutige Unfälle und tödliche Attacken auf Schwimmer und Wassersportler häufen. Cop Meredith Hernandez und der Biologe Peter vermuten einen Hai hinter den Angriffen. Noch ahnt keiner, dass es nicht bei einem Hai bleibt. Eine ganze Familie gefräßiger Killer muss nun zur Strecke gebracht werden. Mit Unterstützung von Clint wollen sie die tödliche Bedrohung in Lake Tahoe ein für alle Mal eliminieren. Es wird ein Sommer, den niemand dort vergessen wird.",9.0,"Parkside Pictures, FLF Films, Bottom Line Entertainment, Almost Never Films",United States of America,2015-10-02,0,92.0,English,Released,,Shark Lake,3.5,69
329540,1950000,Action,,329540,,en,The Marine 4: Moving Target,"WWE-Superstar Mike „The Miz“ Mizanin ist zurück! Als Marine Jake Carter ist er erneut der Held in einem nervenzerreißenden Abenteuer. Carter arbeitet inzwischen bei einem privaten Sicherheitsdienst und muss eine „hochrangige Zielperson“ schützen – eine umwerfend schöne Whistleblowerin, die die Machenschaften eines korrupten Rüstungsunternehmens aufdecken will. Ein schwer bewaffnetes Söldnerteam hat den Auftrag, sie und alle, die sich ihnen in den Weg stellen, zu töten. Nur eine furchtlose Kampfmaschine wie Carter kann sie stoppen.",12.56,WWE Studios,United States of America,2015-04-10,0,86.0,English,Released,Es gibt nichts Mächtigeres als einen amerikanischen Helden.,The Marine 4: Moving Target,6.3,237
159037,0,"Dokumentarfilm, Drama, Historie",,159037,,ar,The Square,"Im ""Arabischen Frühling"" von 2011 lehnten sich Bürger unterschiedlicher arabischer Staaten gegen ihre autoritären Herrscher auf, darunter auch ägyptische Protestler gegen den Diktatator Husni Mubarak. Die Netflix-Dokumentation ""The Square"" hat fünf ägyptische  Revolutionäre zwei Jahre lang begleitet und zeigt den ideologischen Kampf dieser mutigen Menschen. Dabei wird klar, dass der Aufstand viel mehr als nur ein politischer Umschwung für die Demonstranten darstellte, sondern dass er auch deren privates Leben und Hoffnungen maßgeblich mitgeprägt hat und  ihr Kampf für eine neue Gesellschaft noch lange nicht beendet ist.",5.016,"Roast Beef Productions, Worldview Entertainment, Noujaim Films, The Othrs","Egypt, United Kingdom, United States of America",2013-06-07,0,104.0,العربية,Released,,The Square,7.673,150
12838,0,Drama,,12838,,fr,Chacun sa nuit,"Die Geschwister Lucy und Pierre sowie ihre Freunde Nicolas, Sebastien und Baptiste aus der französischen Provence sind die besten Kumpel. Trotzdem hat jeder so seine kleinen Geheimnisse vor den anderen. Zum Beispiel, dass Lucy und Pierre einander mehr und anders lieben, als Geschwister das normalerweise tun. Oder, dass Pierre mitunter gern mit älteren Männern schläft - Gruppenorgien eingeschlossen. Als Pierre eines Tages totgeschlagen neben der Straße liegt und die Polizei im Dunkeln tappt, setzt Lucy alles daran, den oder die Täter auf eigene Faust zu enttarnen.",11.318,"Région Provence Côte d'Azur, La Fabrique de Films, Toloda, Soficinéma 2, CNC, Canal+",France,2006-07-21,0,95.0,Français,Released,,Jedem seine Nacht,6.2,34
157293,0,Drama,,157293,,hi,एबीसीडी,"Vishnu lebt mit vollem Herzen und Körpereinsatz fürs Tanzen. Er hat die Tanzgruppe Swish gegründet und mit ihr große Erfolge gefeiert. Als sein hinterlistiger Geschäftspartner ihn feuert, entscheidet er, Mumbai für immer zu verlassen. In seiner letzten Nacht dort begegnet er einer Straßen-Tanzgruppe, die ihn an den Beginn seiner Karriere erinnert und sein Leben für immer verändert.",6.433,UTV Motion Pictures,India,2013-02-07,222000,155.0,हिन्दी,Released,,ABCD - Any Body Can Dance,5.9,55
356987,0,"Drama, Thriller, Abenteuer",,356987,,en,Abandoned,"Im Jahr 1989 stechen die vier Männer Jim, John, Rick und Phil mit einem Trimaran in See, um vom neuseeländischen Picton nach Tonga zu segeln. Während zunächst alles glatt läuft, werden sie eines Tages von einer riesigen Welle überrascht, die das Boot kentern lässt. Nahezu manövrierunfähig, treiben sie hilflos übers Meer. Zur selben Zeit starten ihre Freunde und Familien eine große Suchaktion, die jedoch auch nach Wochen nicht von Erfolg gekrönt ist. Die Männer selbst versuchen derweil, ihre knappen Vorräte einzuteilen, neue Nahrung zu beschaffen und währenddessen den Gefahren auf hoher See zu trotzen. Dabei nehmen auf dem engen Raum auch die Spannungen und Schuldzuweisungen innerhalb der Gruppe zu. Doch nur wenn es ihnen gelingt, ihre Differenzen zu überwinden, haben sie eine Chance zu überleben.",16.423,Making Movies,New Zealand,2015-08-30,0,86.0,English,Released,,The Turn - Verschollen im Südpazifik,5.9,122
295886,1900000,Drama,,295886,,en,Brotherly Love,"Vor dem Hintergrund der schweren sozioökonomischen Situation für Afroamerikaner in den Vierteln Philadelphias, verfolgt Sergio Taylor (Eric D. Hill Jr.) eine Karriere als Basketball-Profi. Sein älterer Bruder June (Cory Hardrict) plante auch einmal den Werdegang eines Sportlers, bevor er nach dem Tod des Vaters die Mutter (Macy Gray) unterstützen und sich um das Familieneinkommen kümmern musste. Das Küken der Familie, die musikalische Jackie (Keke Palmer), arbeitet an ihrem Erfolg als Sängerin, doch dann steht sie vor den Herausforderungen der ersten Liebe.",4.841,,United States of America,2015-04-24,0,89.0,English,Released,,Brotherly Love,7.036,83
33511,1500000,Drama,,33511,,en,Nowhere Boy,"Liverpool in den Fünfzigern: John Lennon 15 Jahre alt und von der Schule genervt, fällt zu Hause bei seiner strengen Tante Mimi die Decke auf den Kopf. Eines Tages trifft John jedoch seine Mutter Julia wieder, die den Fünfjährigen damals überstürzt verlassen hatte.  Die lebenslustige, musikbegeisterte Frau führt John in die aufregende neue Welt des Rock'n'Roll ein und bringt ihm das Banjospielen bei - nicht ahnend, dass sie damit den Grundstein für Lennons späteren Lebensweg legt. John gründet eine Band und lernt über Freunde den talentierten Gitarristen Paul McCartney  kennen.  Doch der Spagat zwischen seinen musikalischen Ambitionen und den zwei starken Frauen in seinem Leben wird für Lennon zur Zerreißprobe ...",14.006,"Lipsync Productions, Ecosse Films, UK Film Council, Aver Media, North West Vision, Film4 Productions","Canada, United Kingdom",2009-12-25,6577779,93.0,English,Released,,Nowhere Boy,7.2,816
62677,0,"Drama, Musik",,62677,,en,Songcatcher,,1.915,"Rigas Entertainment, ErgoArts",United States of America,2001-03-01,0,109.0,English,Released,,Songcatcher,6.1,35
